{
  "object_type": "RepresentationReceipt",
  "schema_version": "1.0.0",
  "receipt_id": "representation-receipt:example:map-tile:20260804",
  "subject_ref": "kfm://claim/example",
  "representation_type": "MAP_TILE",
  "evidence_bundle_refs": [
    "kfm://evidence-bundle/example"
  ],
  "inputs": [
    {
      "artifact_ref": "kfm://artifact/input/example",
      "digest": "sha256:aaaaaaaaaaaaaaaaaaaaaaaaaaaaaaaaaaaaaaaaaaaaaaaaaaaaaaaaaaaaaaaa"
    }
  ],
  "outputs": [
    {
      "artifact_ref": "kfm://artifact/output/example",
      "digest": "sha256:bbbbbbbbbbbbbbbbbbbbbbbbbbbbbbbbbbbbbbbbbbbbbbbbbbbbbbbbbbbbbbbb",
      "media_type": "application/vnd.mapbox-vector-tile"
    }
  ],
  "method": {
    "method_id": "kfm://method/tile-export",
    "method_version": "1.0.0",
    "spec_hash": "sha256:cccccccccccccccccccccccccccccccccccccccccccccccccccccccccccccccc",
    "parameters_hash": "sha256:dddddddddddddddddddddddddddddddddddddddddddddddddddddddddddddddd"
  },
  "fidelity": {
    "evidence_fidelity": "EXACT",
    "representation_fidelity": "EXACT",
    "information_loss": false,
    "loss_notes": null
  },
  "reality_boundary_note_ref": null,
  "timing": {
    "represented_at": "2026-08-04T12:00:00Z",
    "input_as_of": "2026-08-04T11:00:00Z"
  },
  "lineage": {
    "supersedes": null,
    "superseded_by": null
  },
  "governance": {
    "authority_created": false,
    "policy_evaluated": false,
    "review_completed": false,
    "release_authorized": false,
    "public_use_allowed": false,
    "release_ref": null
  }
}
